{
  "schema_version": "judge_input_schema_v3",
  "record_id": "SAMPLE_UCI_POR__S-T14__baseline_first_20_rows",
  "evaluation_run_id": "llm_judge_v3_uci_rerun",
  "dataset_id": "SAMPLE_UCI_POR",
  "task_id": "S-T14",
  "explanation_mode": "baseline_first_20_rows",
  "prompt_version": "judge_prompt_v3_uci_rerun",
  "rubric_version": "judge_rubric_1_to_10_v3_uci_rerun_candidate",
  "task_context": {
    "task_name": "Social balance vs performance",
    "scope": "1 student + cohort context",
    "actionable_question": "Is my social life balanced with my academic commitments?",
    "target_audience": "student",
    "ai_summary_type": "correlation_evidence",
    "ai_prompt_hint": "Compare the selected student against the class social-balance scatter. Highlight the student's position and any cohort-level association between social_balance_score and avg_score. Frame as correlation, not causation.",
    "query_labels": [
      "social_balance_scatter"
    ],
    "explanation_strategy": "correlation"
  },
  "schema_context": {
    "source_tables": [
      "student",
      "assessment_result",
      "assessment [UCI only]"
    ],
    "key_db_fields": [
      "social_balance_score [FE single]",
      "avg_score [FE cross]",
      "free_time",
      "go_out_freq",
      "alcohol_weekday"
    ],
    "output_schema": {
      "required_columns": [
        "student_id",
        "point_role",
        "social_balance_score",
        "avg_score"
      ],
      "optional_columns": [
        "is_current_student",
        "free_time",
        "go_out_freq",
        "alcohol_weekday",
        "alcohol_weekend"
      ]
    },
    "query_labels": [
      "social_balance_scatter"
    ]
  },
  "explanation": {
    "raw_text": "Summary: There appears to be a positive correlation between Social Balance Score and Average Score, suggesting that students with a more balanced social life tend to perform better academically. This relationship indicates that maintaining a healthy social life may support your academic success.\n\nInsights: Positive Correlation Observed: As the Social Balance Score increases, the Average Score also tends to increase, indicating a positive relationship. This suggests that students who manage their social activities well may achieve higher academic performance.\n\nEducational implications: Balancing social activities with academic responsibilities may enhance overall performance.\n\nRecommendations: high - Engage in social activities that promote collaboration and study groups. - Participating in social activities can help you build relationships that support your learning and academic success.",
    "structured_payload": {
      "task_id": "S-T14",
      "execution_id": "exec_1781847244450_82431706",
      "explanation": {
        "summary": "There appears to be a positive correlation between Social Balance Score and Average Score, suggesting that students with a more balanced social life tend to perform better academically. This relationship indicates that maintaining a healthy social life may support your academic success.",
        "insights": [
          {
            "title": "Positive Correlation Observed",
            "description": "As the Social Balance Score increases, the Average Score also tends to increase, indicating a positive relationship. This suggests that students who manage their social activities well may achieve higher academic performance.",
            "severity": "medium",
            "evidence": [
              {
                "metric": "social_balance_score",
                "value": 0.5,
                "comparison": "baseline",
                "delta": null,
                "context": "Average scores vary significantly among students with this score."
              }
            ]
          }
        ],
        "educational_implications": [
          "Balancing social activities with academic responsibilities may enhance overall performance."
        ],
        "recommendations": [
          {
            "priority": "high",
            "action": "Engage in social activities that promote collaboration and study groups.",
            "rationale": "Participating in social activities can help you build relationships that support your learning and academic success."
          }
        ],
        "warnings": []
      },
      "confidence": {
        "level": "HIGH",
        "reason": "The dataset is robust with 649 rows, providing a strong basis for correlation analysis.",
        "based_on": [
          "sufficient_data"
        ]
      },
      "explanation_strategy": "correlation",
      "explanation_type": "correlation",
      "ai_summary_method": "baseline_first_20_rows",
      "ai_summary_version": "baseline",
      "baseline_available": true,
      "input_summary_type": "raw_first_20_rows",
      "ai_summary_method_warning": null,
      "full_result_row_count": null,
      "included_row_count": null,
      "small_result_threshold": null,
      "small_result_full_rows_applied": null,
      "dataset_row_breakdown": [],
      "safety_flags": [],
      "degraded": false,
      "meta": {
        "model": "gpt-4o-mini-2024-07-18",
        "latency_ms": 6317,
        "token_usage": {
          "prompt_tokens": 2476,
          "completion_tokens": 314,
          "total_tokens": 2790
        },
        "strategy": "correlation",
        "granularity": "semester",
        "cost_usd": 0.00056
      }
    },
    "generation_metadata": {
      "explanation_artifact_path": "Docs/evaluation_v2/Runs/full_208/phase8_explanations/baseline_first_20_rows/SAMPLE_UCI_POR/explanation_artifacts/SAMPLE_UCI_POR__S-T14__baseline_first_20_rows.json",
      "explanation_artifact_sha256": "b4519f59ea216eb1dcea9e2954e98b220de7044018d10a0d74c7d1c0aee6d253",
      "ai_service_url": "http://localhost:8000",
      "expected_ai_summary_method": "baseline_first_20_rows",
      "observed_ai_summary_method": "baseline_first_20_rows",
      "degraded": false,
      "model": "gpt-4o-mini-2024-07-18",
      "token_usage": {
        "prompt_tokens": 2476,
        "completion_tokens": 314,
        "total_tokens": 2790
      },
      "latency_ms": 6326,
      "attempts_used": 1
    }
  },
  "evidence_access": {
    "full_result_row_count": 649,
    "full_query_artifacts": [
      {
        "dataset_label": "social_balance_scatter",
        "artifact_path": "Docs/evaluation_v2/Runs/full_208/phase8_evidence_sql/SAMPLE_UCI_POR/full_query_artifacts/SAMPLE_UCI_POR__S-T14.json",
        "artifact_sha256": "a8efc8a5a1bdaaba7b3e423a3a55186922980fc83b1f32258aef8c20d65aef28",
        "row_count": 649,
        "readable": true
      }
    ],
    "evidence_access_mode": "deterministic_artifact_retrieval",
    "small_result_row_threshold": 20,
    "direct_embedding_token_budget": 120000,
    "prompt_embedded_row_count": 0,
    "retrieved_row_count": 649,
    "retrieved_row_count_by_dataset": {
      "social_balance_scatter": 649
    },
    "retrieved_row_ranges": [
      {
        "dataset_label": "social_balance_scatter",
        "start": 0,
        "end": 648
      }
    ],
    "retrieved_chunk_ids": [
      "SAMPLE_UCI_POR__S-T14__baseline_first_20_rows__social_balance_scatter__chunk_1"
    ],
    "retrieval_log_path": "Docs/evaluation_v2/Runs/full_208/phase8_judge_inputs/retrieval_logs/SAMPLE_UCI_POR__S-T14__baseline_first_20_rows.json",
    "retrieval_request_complete": true,
    "retrieval_coverage_status": "full",
    "full_access_available": true,
    "deterministic_scan_scope": "full_query_artifact_all_rows",
    "deterministic_scan_row_count_by_dataset": {
      "social_balance_scatter": 649
    },
    "full_result_sent_to_llm": false,
    "deterministic_checks": [],
    "checked_claim_types": [],
    "unchecked_claim_types": [
      "semantic_interpretation",
      "causal_framing",
      "actionability_quality"
    ],
    "judge_evidence_citations": []
  },
  "evaluation_requirements": {
    "required_core_outputs": [
      {
        "requirement_id": "S-T14-CORE-01",
        "description": "Compare the selected student against the class social-balance scatter."
      },
      {
        "requirement_id": "S-T14-CORE-02",
        "description": "Highlight the student's position and any cohort-level association between social_balance_score and avg_score."
      }
    ],
    "required_supporting_outputs": [],
    "evaluation_constraints": [
      {
        "constraint_id": "S-T14-CONSTRAINT-01",
        "description": "Frame as correlation, not causation."
      }
    ],
    "safety_fairness_applicability": "applicable",
    "safety_fairness_note": "Conservative pilot default; human review is required before any not_applicable exception."
  },
  "derived_stat_evidence": [
    {
      "stat_id": "S-T14__pearson_r__1",
      "stat_type": "pearson_r",
      "dataset_label": "social_balance_scatter",
      "x_column": "social_balance_score",
      "y_column": "avg_score",
      "source_artifact_path": "Docs/evaluation_v2/Runs/full_208/phase8_evidence_sql/SAMPLE_UCI_POR/full_query_artifacts/SAMPLE_UCI_POR__S-T14.json",
      "source_artifact_sha256": "a8efc8a5a1bdaaba7b3e423a3a55186922980fc83b1f32258aef8c20d65aef28",
      "status": "pass",
      "pearson_r": 0.014366885251951421,
      "n": 649,
      "strength_label": "negligible",
      "direction": "positive",
      "skip_reason": null
    }
  ]
}
