{
  "schema_version": "judge_input_schema_v3",
  "record_id": "SAMPLE_UCI_POR__A-G09__task_aware_data_summarization",
  "evaluation_run_id": "llm_judge_v3_uci_rerun",
  "dataset_id": "SAMPLE_UCI_POR",
  "task_id": "A-G09",
  "explanation_mode": "task_aware_data_summarization",
  "prompt_version": "judge_prompt_v3_uci_rerun",
  "rubric_version": "judge_rubric_1_to_10_v3_uci_rerun_candidate",
  "task_context": {
    "task_name": "Socioeconomic disadvantage impact",
    "scope": "Many students",
    "actionable_question": "Are disadvantaged students receiving adequate support?",
    "target_audience": "academic_advisor, admin",
    "ai_summary_type": "correlation_evidence",
    "ai_prompt_hint": "Describe trend. Highlight which imd_band groups have most at-risk students. Recommend equity-aware support.",
    "query_labels": [
      "disadvantage_impact"
    ],
    "explanation_strategy": "correlation"
  },
  "schema_context": {
    "source_tables": [
      "student",
      "enrollment",
      "assessment_result",
      "assessment [OULAD only]"
    ],
    "key_db_fields": [
      "imd_score_numeric",
      "disability_flag",
      "highest_education",
      "disadvantage_score [FE single]; avg_score [FE cross]",
      "final_outcome"
    ],
    "output_schema": {},
    "query_labels": [
      "disadvantage_impact"
    ]
  },
  "explanation": {
    "raw_text": "Summary: The analysis could not be conducted due to the absence of data in the dataset. Therefore, no correlation patterns between Disadvantage Score and Average Score can be identified.\n\nEducational implications: Without data, it is impossible to assess the impact of socioeconomic disadvantage on student learning outcomes.\n\nWarnings: The dataset contains no rows, which limits the ability to draw any conclusions or make recommendations.",
    "structured_payload": {
      "task_id": "A-G09",
      "execution_id": "exec_1781847232641_b19ca6ff",
      "explanation": {
        "summary": "The analysis could not be conducted due to the absence of data in the dataset. Therefore, no correlation patterns between Disadvantage Score and Average Score can be identified.",
        "insights": [],
        "educational_implications": [
          "Without data, it is impossible to assess the impact of socioeconomic disadvantage on student learning outcomes."
        ],
        "recommendations": [],
        "warnings": [
          "The dataset contains no rows, which limits the ability to draw any conclusions or make recommendations."
        ]
      },
      "confidence": {
        "level": "LOW",
        "reason": "No data available for analysis.",
        "based_on": [
          "sparse_data"
        ]
      },
      "explanation_strategy": "correlation",
      "explanation_type": "correlation",
      "ai_summary_method": "task_aware_data_summarization",
      "ai_summary_version": "v1",
      "baseline_available": true,
      "input_summary_type": "full_rows_due_to_small_result",
      "ai_summary_method_warning": null,
      "full_result_row_count": 0,
      "included_row_count": 0,
      "small_result_threshold": 20,
      "small_result_full_rows_applied": true,
      "dataset_row_breakdown": [
        {
          "dataset_name": "disadvantage_impact",
          "row_count": 0,
          "included_row_count": 0
        }
      ],
      "safety_flags": [],
      "degraded": false,
      "meta": {
        "model": "gpt-4o-mini-2024-07-18",
        "latency_ms": 3739,
        "token_usage": {
          "prompt_tokens": 672,
          "completion_tokens": 135,
          "total_tokens": 807
        },
        "strategy": "correlation",
        "granularity": "cohort_aggregate",
        "cost_usd": 0.000182
      }
    },
    "generation_metadata": {
      "explanation_artifact_path": "Docs/evaluation_v2/Runs/full_208/phase8_explanations/task_aware_data_summarization/SAMPLE_UCI_POR/explanation_artifacts/SAMPLE_UCI_POR__A-G09__task_aware_data_summarization.json",
      "explanation_artifact_sha256": "ad5b827751deaf18d8e9065c6875ba77c548ef0216b3ae82bad9826826d94327",
      "ai_service_url": "http://localhost:8000",
      "expected_ai_summary_method": "task_aware_data_summarization",
      "observed_ai_summary_method": "task_aware_data_summarization",
      "degraded": false,
      "model": "gpt-4o-mini-2024-07-18",
      "token_usage": {
        "prompt_tokens": 672,
        "completion_tokens": 135,
        "total_tokens": 807
      },
      "latency_ms": 3757,
      "attempts_used": 1
    }
  },
  "evidence_access": {
    "full_result_row_count": 0,
    "full_query_artifacts": [
      {
        "dataset_label": "disadvantage_impact",
        "artifact_path": "Docs/evaluation_v2/Runs/full_208/phase8_evidence_sql/SAMPLE_UCI_POR/full_query_artifacts/SAMPLE_UCI_POR__A-G09.json",
        "artifact_sha256": "445982af9f84730af9a456522b5e80733c6d2c4e54f7d32482c593604b370843",
        "row_count": 0,
        "readable": true
      }
    ],
    "evidence_access_mode": "direct_embedding",
    "small_result_row_threshold": 20,
    "direct_embedding_token_budget": 120000,
    "prompt_embedded_row_count": 0,
    "retrieved_row_count": 0,
    "retrieved_row_count_by_dataset": {},
    "retrieved_row_ranges": [],
    "retrieved_chunk_ids": [],
    "retrieval_log_path": null,
    "retrieval_request_complete": true,
    "retrieval_coverage_status": "not_applicable",
    "full_access_available": true,
    "deterministic_scan_scope": "full_query_artifact_all_rows",
    "deterministic_scan_row_count_by_dataset": {
      "disadvantage_impact": 0
    },
    "full_result_sent_to_llm": true,
    "deterministic_checks": [],
    "checked_claim_types": [],
    "unchecked_claim_types": [
      "semantic_interpretation",
      "causal_framing",
      "actionability_quality"
    ],
    "judge_evidence_citations": []
  },
  "evaluation_requirements": {
    "required_core_outputs": [
      {
        "requirement_id": "A-G09-CORE-01",
        "description": "Describe trend."
      },
      {
        "requirement_id": "A-G09-CORE-02",
        "description": "Highlight which imd_band groups have most at-risk students."
      },
      {
        "requirement_id": "A-G09-CORE-03",
        "description": "Recommend equity-aware support."
      }
    ],
    "required_supporting_outputs": [],
    "evaluation_constraints": [
      {
        "constraint_id": "A-G09-CONSTRAINT-01",
        "description": "Describe group-level patterns only; do not name individual students in equity analysis."
      },
      {
        "constraint_id": "A-G09-CONSTRAINT-02",
        "description": "Frame socioeconomic factors as context and association, not individual blame or deterministic cause."
      }
    ],
    "safety_fairness_applicability": "applicable",
    "safety_fairness_note": "Applicable because the task analyses socioeconomic disadvantage and recommends equity-aware support."
  },
  "derived_stat_evidence": [
    {
      "stat_id": "A-G09__pearson_r__1",
      "stat_type": "pearson_r",
      "dataset_label": "disadvantage_impact",
      "x_column": "disadvantage_score",
      "y_column": "avg_score",
      "source_artifact_path": "Docs/evaluation_v2/Runs/full_208/phase8_evidence_sql/SAMPLE_UCI_POR/full_query_artifacts/SAMPLE_UCI_POR__A-G09.json",
      "source_artifact_sha256": "445982af9f84730af9a456522b5e80733c6d2c4e54f7d32482c593604b370843",
      "status": "skipped",
      "pearson_r": null,
      "n": 0,
      "strength_label": null,
      "direction": null,
      "skip_reason": "zero_rows"
    }
  ]
}
