{
  "schema_version": "judge_input_schema_v3",
  "record_id": "SAMPLE_UCI_POR__S-T13__task_aware_data_summarization",
  "evaluation_run_id": "llm_judge_v3_uci_rerun",
  "dataset_id": "SAMPLE_UCI_POR",
  "task_id": "S-T13",
  "explanation_mode": "task_aware_data_summarization",
  "prompt_version": "judge_prompt_v3_uci_rerun",
  "rubric_version": "judge_rubric_1_to_10_v3_uci_rerun_candidate",
  "task_context": {
    "task_name": "Action plan generation",
    "scope": "1 student",
    "actionable_question": "What should I do differently starting next week?",
    "target_audience": "student",
    "ai_summary_type": "action_synthesis",
    "ai_prompt_hint": "Synthesise all [FE] risk signals into 3–5 prioritised actions. Reference which FE feature triggered each item.",
    "query_labels": [
      "synthesis_data"
    ],
    "explanation_strategy": "risk"
  },
  "schema_context": {
    "source_tables": [
      "enrollment",
      "student"
    ],
    "key_db_fields": [
      "[AI_SYNTHESIS] avg_score [FE cross]",
      "at_risk_score [FE cross]",
      "engagement_score [FE cross]",
      "absence_rate [FE single]",
      "performance_trend [FE cross]",
      "lifestyle_risk_score [FE single]"
    ],
    "output_schema": {},
    "query_labels": [
      "synthesis_data"
    ]
  },
  "explanation": {
    "raw_text": "Summary: Currently, there are no supported actions generated for you. This means that there are no specific recommendations based on the available data.",
    "structured_payload": {
      "task_id": "S-T13",
      "execution_id": "exec_1781847244412_fccd48cb",
      "explanation": {
        "summary": "Currently, there are no supported actions generated for you. This means that there are no specific recommendations based on the available data.",
        "insights": [],
        "educational_implications": [],
        "recommendations": [],
        "warnings": []
      },
      "confidence": {
        "level": "HIGH",
        "reason": "No data available to support any actions.",
        "based_on": [
          "sufficient_data"
        ]
      },
      "explanation_strategy": "risk",
      "explanation_type": "risk",
      "ai_summary_method": "task_aware_data_summarization",
      "ai_summary_version": "v1",
      "baseline_available": true,
      "input_summary_type": "full_rows_due_to_small_result",
      "ai_summary_method_warning": null,
      "full_result_row_count": 1,
      "included_row_count": 1,
      "small_result_threshold": 20,
      "small_result_full_rows_applied": true,
      "dataset_row_breakdown": [
        {
          "dataset_name": "synthesis_data",
          "row_count": 1,
          "included_row_count": 1
        }
      ],
      "safety_flags": [],
      "degraded": false,
      "meta": {
        "model": "gpt-4o-mini-2024-07-18",
        "latency_ms": 2693,
        "token_usage": {
          "prompt_tokens": 761,
          "completion_tokens": 92,
          "total_tokens": 853
        },
        "strategy": "risk",
        "granularity": "semester",
        "cost_usd": 0.000169
      }
    },
    "generation_metadata": {
      "explanation_artifact_path": "Docs/evaluation_v2/Runs/full_208/phase8_explanations/task_aware_data_summarization/SAMPLE_UCI_POR/explanation_artifacts/SAMPLE_UCI_POR__S-T13__task_aware_data_summarization.json",
      "explanation_artifact_sha256": "10871221df584901a1e9750c3d6b2f9dc50f13864d0200bcd32f15fb578decd1",
      "ai_service_url": "http://localhost:8000",
      "expected_ai_summary_method": "task_aware_data_summarization",
      "observed_ai_summary_method": "task_aware_data_summarization",
      "degraded": false,
      "model": "gpt-4o-mini-2024-07-18",
      "token_usage": {
        "prompt_tokens": 761,
        "completion_tokens": 92,
        "total_tokens": 853
      },
      "latency_ms": 2701,
      "attempts_used": 1
    }
  },
  "evidence_access": {
    "full_result_row_count": 1,
    "full_query_artifacts": [
      {
        "dataset_label": "synthesis_data",
        "artifact_path": "Docs/evaluation_v2/Runs/full_208/phase8_evidence_sql/SAMPLE_UCI_POR/full_query_artifacts/SAMPLE_UCI_POR__S-T13.json",
        "artifact_sha256": "2a08d11768009472115b7a9a214f6b1876c84e1de53b92b868f70b36c8338d67",
        "row_count": 1,
        "readable": true
      }
    ],
    "evidence_access_mode": "direct_embedding",
    "small_result_row_threshold": 20,
    "direct_embedding_token_budget": 120000,
    "prompt_embedded_row_count": 1,
    "retrieved_row_count": 0,
    "retrieved_row_count_by_dataset": {},
    "retrieved_row_ranges": [],
    "retrieved_chunk_ids": [],
    "retrieval_log_path": null,
    "retrieval_request_complete": true,
    "retrieval_coverage_status": "not_applicable",
    "full_access_available": true,
    "deterministic_scan_scope": "full_query_artifact_all_rows",
    "deterministic_scan_row_count_by_dataset": {
      "synthesis_data": 1
    },
    "full_result_sent_to_llm": true,
    "deterministic_checks": [],
    "checked_claim_types": [],
    "unchecked_claim_types": [
      "semantic_interpretation",
      "causal_framing",
      "actionability_quality"
    ],
    "judge_evidence_citations": []
  },
  "evaluation_requirements": {
    "required_core_outputs": [
      {
        "requirement_id": "S-T13-CORE-01",
        "description": "Synthesise all [FE] risk signals into 3–5 prioritised actions."
      },
      {
        "requirement_id": "S-T13-CORE-02",
        "description": "Reference which FE feature triggered each item."
      }
    ],
    "required_supporting_outputs": [],
    "evaluation_constraints": [
      {
        "constraint_id": "S-T13-CONSTRAINT-01",
        "description": "Do not include actions that reference signals not present in returned data."
      },
      {
        "constraint_id": "S-T13-CONSTRAINT-02",
        "description": "Do not invent risk context, urgency, or priority unsupported by returned feature-engineered signals."
      }
    ],
    "safety_fairness_applicability": "applicable",
    "safety_fairness_note": "Conservative pilot default; human review is required before any not_applicable exception."
  },
  "derived_stat_evidence": []
}
