{
  "schema_version": "judge_input_schema_v3",
  "record_id": "SAMPLE_UCI_POR__S-T14__task_aware_data_summarization",
  "evaluation_run_id": "llm_judge_v3_uci_rerun",
  "dataset_id": "SAMPLE_UCI_POR",
  "task_id": "S-T14",
  "explanation_mode": "task_aware_data_summarization",
  "prompt_version": "judge_prompt_v3_uci_rerun",
  "rubric_version": "judge_rubric_1_to_10_v3_uci_rerun_candidate",
  "task_context": {
    "task_name": "Social balance vs performance",
    "scope": "1 student + cohort context",
    "actionable_question": "Is my social life balanced with my academic commitments?",
    "target_audience": "student",
    "ai_summary_type": "correlation_evidence",
    "ai_prompt_hint": "Compare the selected student against the class social-balance scatter. Highlight the student's position and any cohort-level association between social_balance_score and avg_score. Frame as correlation, not causation.",
    "query_labels": [
      "social_balance_scatter"
    ],
    "explanation_strategy": "correlation"
  },
  "schema_context": {
    "source_tables": [
      "student",
      "assessment_result",
      "assessment [UCI only]"
    ],
    "key_db_fields": [
      "social_balance_score [FE single]",
      "avg_score [FE cross]",
      "free_time",
      "go_out_freq",
      "alcohol_weekday"
    ],
    "output_schema": {
      "required_columns": [
        "student_id",
        "point_role",
        "social_balance_score",
        "avg_score"
      ],
      "optional_columns": [
        "is_current_student",
        "free_time",
        "go_out_freq",
        "alcohol_weekday",
        "alcohol_weekend"
      ]
    },
    "query_labels": [
      "social_balance_scatter"
    ]
  },
  "explanation": {
    "raw_text": "Summary: The analysis shows a weak positive correlation between Social Balance Score and Average Score. This suggests that as your social balance improves, your average score may also increase, but the relationship is not very strong.\n\nInsights: Weak Positive Correlation: The correlation coefficient of 0.0144 indicates a weak positive relationship between your social balance and average score. This means that while there is a slight tendency for students with better social balance to have higher average scores, the connection is not strong enough to rely on.\n\nEducational implications: Improving your social balance may have a small positive effect on your academic performance.\n\nRecommendations: medium - Engage in social activities that also support your academic goals. - Balancing social life with academic commitments can enhance both your well-being and performance.",
    "structured_payload": {
      "task_id": "S-T14",
      "execution_id": "exec_1781847244450_82431706",
      "explanation": {
        "summary": "The analysis shows a weak positive correlation between Social Balance Score and Average Score. This suggests that as your social balance improves, your average score may also increase, but the relationship is not very strong.",
        "insights": [
          {
            "title": "Weak Positive Correlation",
            "description": "The correlation coefficient of 0.0144 indicates a weak positive relationship between your social balance and average score. This means that while there is a slight tendency for students with better social balance to have higher average scores, the connection is not strong enough to rely on.",
            "severity": "medium",
            "evidence": [
              {
                "metric": "coefficient",
                "value": 0.0144,
                "comparison": "baseline",
                "delta": null,
                "context": "This coefficient reflects the overall relationship in the dataset."
              }
            ]
          }
        ],
        "educational_implications": [
          "Improving your social balance may have a small positive effect on your academic performance."
        ],
        "recommendations": [
          {
            "priority": "medium",
            "action": "Engage in social activities that also support your academic goals.",
            "rationale": "Balancing social life with academic commitments can enhance both your well-being and performance."
          }
        ],
        "warnings": []
      },
      "confidence": {
        "level": "MEDIUM",
        "reason": "The correlation is weak, and no statistical significance is established.",
        "based_on": [
          "sparse_data"
        ]
      },
      "explanation_strategy": "correlation",
      "explanation_type": "correlation",
      "ai_summary_method": "task_aware_data_summarization",
      "ai_summary_version": "v1",
      "baseline_available": true,
      "input_summary_type": "correlation_evidence",
      "ai_summary_method_warning": null,
      "full_result_row_count": 649,
      "included_row_count": null,
      "small_result_threshold": 20,
      "small_result_full_rows_applied": false,
      "dataset_row_breakdown": [
        {
          "dataset_name": "social_balance_scatter",
          "row_count": 649,
          "included_row_count": 649
        }
      ],
      "safety_flags": [],
      "degraded": false,
      "meta": {
        "model": "gpt-4o-mini-2024-07-18",
        "latency_ms": 5721,
        "token_usage": {
          "prompt_tokens": 1232,
          "completion_tokens": 319,
          "total_tokens": 1551
        },
        "strategy": "correlation",
        "granularity": "semester",
        "cost_usd": 0.000376
      }
    },
    "generation_metadata": {
      "explanation_artifact_path": "Docs/evaluation_v2/Runs/full_208/phase8_explanations/task_aware_data_summarization/SAMPLE_UCI_POR/explanation_artifacts/SAMPLE_UCI_POR__S-T14__task_aware_data_summarization.json",
      "explanation_artifact_sha256": "3436763013e55896d83ba55274aa20ffdf6c659751a0db872aaf0e57d7e1b22c",
      "ai_service_url": "http://localhost:8000",
      "expected_ai_summary_method": "task_aware_data_summarization",
      "observed_ai_summary_method": "task_aware_data_summarization",
      "degraded": false,
      "model": "gpt-4o-mini-2024-07-18",
      "token_usage": {
        "prompt_tokens": 1232,
        "completion_tokens": 319,
        "total_tokens": 1551
      },
      "latency_ms": 5730,
      "attempts_used": 1
    }
  },
  "evidence_access": {
    "full_result_row_count": 649,
    "full_query_artifacts": [
      {
        "dataset_label": "social_balance_scatter",
        "artifact_path": "Docs/evaluation_v2/Runs/full_208/phase8_evidence_sql/SAMPLE_UCI_POR/full_query_artifacts/SAMPLE_UCI_POR__S-T14.json",
        "artifact_sha256": "a8efc8a5a1bdaaba7b3e423a3a55186922980fc83b1f32258aef8c20d65aef28",
        "row_count": 649,
        "readable": true
      }
    ],
    "evidence_access_mode": "deterministic_artifact_retrieval",
    "small_result_row_threshold": 20,
    "direct_embedding_token_budget": 120000,
    "prompt_embedded_row_count": 0,
    "retrieved_row_count": 649,
    "retrieved_row_count_by_dataset": {
      "social_balance_scatter": 649
    },
    "retrieved_row_ranges": [
      {
        "dataset_label": "social_balance_scatter",
        "start": 0,
        "end": 648
      }
    ],
    "retrieved_chunk_ids": [
      "SAMPLE_UCI_POR__S-T14__task_aware_data_summarization__social_balance_scatter__chunk_1"
    ],
    "retrieval_log_path": "Docs/evaluation_v2/Runs/full_208/phase8_judge_inputs/retrieval_logs/SAMPLE_UCI_POR__S-T14__task_aware_data_summarization.json",
    "retrieval_request_complete": true,
    "retrieval_coverage_status": "full",
    "full_access_available": true,
    "deterministic_scan_scope": "full_query_artifact_all_rows",
    "deterministic_scan_row_count_by_dataset": {
      "social_balance_scatter": 649
    },
    "full_result_sent_to_llm": false,
    "deterministic_checks": [],
    "checked_claim_types": [],
    "unchecked_claim_types": [
      "semantic_interpretation",
      "causal_framing",
      "actionability_quality"
    ],
    "judge_evidence_citations": []
  },
  "evaluation_requirements": {
    "required_core_outputs": [
      {
        "requirement_id": "S-T14-CORE-01",
        "description": "Compare the selected student against the class social-balance scatter."
      },
      {
        "requirement_id": "S-T14-CORE-02",
        "description": "Highlight the student's position and any cohort-level association between social_balance_score and avg_score."
      }
    ],
    "required_supporting_outputs": [],
    "evaluation_constraints": [
      {
        "constraint_id": "S-T14-CONSTRAINT-01",
        "description": "Frame as correlation, not causation."
      }
    ],
    "safety_fairness_applicability": "applicable",
    "safety_fairness_note": "Conservative pilot default; human review is required before any not_applicable exception."
  },
  "derived_stat_evidence": [
    {
      "stat_id": "S-T14__pearson_r__1",
      "stat_type": "pearson_r",
      "dataset_label": "social_balance_scatter",
      "x_column": "social_balance_score",
      "y_column": "avg_score",
      "source_artifact_path": "Docs/evaluation_v2/Runs/full_208/phase8_evidence_sql/SAMPLE_UCI_POR/full_query_artifacts/SAMPLE_UCI_POR__S-T14.json",
      "source_artifact_sha256": "a8efc8a5a1bdaaba7b3e423a3a55186922980fc83b1f32258aef8c20d65aef28",
      "status": "pass",
      "pearson_r": 0.014366885251951421,
      "n": 649,
      "strength_label": "negligible",
      "direction": "positive",
      "skip_reason": null
    }
  ]
}
